{
  "schemaVersion": "1.1",
  "id": "timeline_1b9rh7x",
  "projectId": "demo_v1_1_project",
  "generationId": "generation_zd0j8a",
  "targetDurationSec": 15,
  "aspectRatio": "9:16",
  "rendererTarget": "html_preview",
  "clips": [
    {
      "id": "clip_15k5ji0",
      "sourceSlotId": "slot_hook_visual",
      "sourceSegmentId": "seg_hook",
      "startSec": 0,
      "durationSec": 2.5,
      "role": "hook",
      "visualIntent": "Opening product/result visual",
      "transitionIn": "none",
      "transitionOut": "hard_cut",
      "gapFillStrategy": "none",
      "layers": [
        {
          "id": "layer_bg_1hczsxh",
          "type": "background",
          "startOffsetSec": 0,
          "durationSec": 2.5,
          "style": {
            "color": "#0f172a"
          }
        },
        {
          "id": "layer_video_x02uhe",
          "type": "video",
          "assetId": "demo_source_video",
          "sourceShotId": "source_shot_1",
          "startOffsetSec": 0,
          "durationSec": 2.5,
          "transform": {
            "fit": "cover",
            "crop": "vertical",
            "motion": "crop_zoom"
          }
        },
        {
          "id": "layer_subtitle_n44qtl",
          "type": "subtitle",
          "startOffsetSec": 0,
          "durationSec": 2.5,
          "text": "便携式桌面加湿器: 小巧便携",
          "style": {
            "position": "lower_third",
            "density": "high"
          }
        }
      ]
    },
    {
      "id": "clip_re2sfv",
      "sourceSlotId": "slot_product_closeup",
      "sourceSegmentId": "seg_body",
      "startSec": 2.5,
      "durationSec": 2.5,
      "role": "body",
      "visualIntent": "Product or feature closeup",
      "transitionIn": "hard_cut",
      "transitionOut": "hard_cut",
      "gapFillStrategy": "none",
      "layers": [
        {
          "id": "layer_bg_8fab7w",
          "type": "background",
          "startOffsetSec": 0,
          "durationSec": 2.5,
          "style": {
            "color": "#0f172a"
          }
        },
        {
          "id": "layer_video_9j2ypv",
          "type": "video",
          "assetId": "demo_source_video",
          "sourceShotId": "source_shot_1",
          "startOffsetSec": 0,
          "durationSec": 2.5,
          "transform": {
            "fit": "cover",
            "crop": "vertical",
            "motion": "crop_zoom"
          }
        },
        {
          "id": "layer_subtitle_jxatvd",
          "type": "subtitle",
          "startOffsetSec": 0,
          "durationSec": 2.5,
          "text": "小巧便携 in one compact design",
          "style": {
            "position": "lower_third",
            "density": "high"
          }
        }
      ]
    },
    {
      "id": "clip_iw0vik",
      "sourceSlotId": "slot_usage_scene",
      "sourceSegmentId": "seg_body",
      "startSec": 5,
      "durationSec": 2.5,
      "role": "body",
      "visualIntent": "Usage/process/context scene",
      "transitionIn": "hard_cut",
      "transitionOut": "hard_cut",
      "gapFillStrategy": "none",
      "layers": [
        {
          "id": "layer_bg_2gif98",
          "type": "background",
          "startOffsetSec": 0,
          "durationSec": 2.5,
          "style": {
            "color": "#0f172a"
          }
        },
        {
          "id": "layer_video_17tg02b",
          "type": "video",
          "assetId": "demo_source_video",
          "sourceShotId": "source_shot_1",
          "startOffsetSec": 0,
          "durationSec": 2.5,
          "transform": {
            "fit": "cover",
            "crop": "vertical",
            "motion": "crop_zoom"
          }
        },
        {
          "id": "layer_subtitle_1hir4us",
          "type": "subtitle",
          "startOffsetSec": 0,
          "durationSec": 2.5,
          "text": "便携式桌面加湿器 fits 办公室久坐人群、学生",
          "style": {
            "position": "lower_third",
            "density": "high"
          }
        }
      ]
    },
    {
      "id": "clip_1n06m9o",
      "sourceSlotId": "slot_text_subtitle",
      "sourceSegmentId": "seg_body",
      "startSec": 7.5,
      "durationSec": 2.5,
      "role": "body",
      "visualIntent": "Short benefit copy",
      "transitionIn": "hard_cut",
      "transitionOut": "hard_cut",
      "gapFillStrategy": "none",
      "layers": [
        {
          "id": "layer_bg_1mw4gfm",
          "type": "background",
          "startOffsetSec": 0,
          "durationSec": 2.5,
          "style": {
            "color": "#0f172a"
          }
        },
        {
          "id": "layer_video_1negkd9",
          "type": "video",
          "assetId": "demo_source_video",
          "sourceShotId": "source_shot_4",
          "startOffsetSec": 0,
          "durationSec": 2.5,
          "transform": {
            "fit": "cover",
            "crop": "vertical",
            "motion": "crop_zoom"
          }
        },
        {
          "id": "layer_subtitle_1fbwcli",
          "type": "subtitle",
          "startOffsetSec": 0,
          "durationSec": 2.5,
          "text": "静音",
          "style": {
            "position": "lower_third",
            "density": "high"
          }
        }
      ]
    },
    {
      "id": "clip_14ek4xg",
      "sourceSlotId": "slot_comparison_scene",
      "sourceSegmentId": "seg_proof",
      "startSec": 10,
      "durationSec": 2.5,
      "role": "proof",
      "visualIntent": "Comparison or proof visual",
      "transitionIn": "hard_cut",
      "transitionOut": "hard_cut",
      "gapFillStrategy": "text_card",
      "layers": [
        {
          "id": "layer_bg_1hsqq7s",
          "type": "background",
          "startOffsetSec": 0,
          "durationSec": 2.5,
          "style": {
            "color": "#0f172a"
          }
        },
        {
          "id": "layer_card_m9q8f5",
          "type": "text_card",
          "startOffsetSec": 0,
          "durationSec": 2.5,
          "text": "小巧便携 with clearer everyday value",
          "style": {
            "card": "mg_motion",
            "role": "proof"
          }
        },
        {
          "id": "layer_subtitle_m9q8f5",
          "type": "subtitle",
          "startOffsetSec": 0,
          "durationSec": 2.5,
          "text": "小巧便携 with clearer everyday value",
          "style": {
            "position": "lower_third",
            "density": "high"
          }
        }
      ]
    },
    {
      "id": "clip_1kpgjst",
      "sourceSlotId": "slot_cta_visual",
      "sourceSegmentId": "seg_cta",
      "startSec": 12.5,
      "durationSec": 2.5,
      "role": "cta",
      "visualIntent": "CTA card or end frame",
      "transitionIn": "hard_cut",
      "transitionOut": "hard_cut",
      "gapFillStrategy": "packaging_overlay",
      "layers": [
        {
          "id": "layer_bg_10rr7i4",
          "type": "background",
          "startOffsetSec": 0,
          "durationSec": 2.5,
          "style": {
            "color": "#0f172a"
          }
        },
        {
          "id": "layer_card_111dmlv",
          "type": "text_card",
          "startOffsetSec": 0,
          "durationSec": 2.5,
          "text": "点击了解更多",
          "style": {
            "card": "mg_motion",
            "role": "cta"
          }
        },
        {
          "id": "layer_subtitle_111dmlv",
          "type": "subtitle",
          "startOffsetSec": 0,
          "durationSec": 2.5,
          "text": "点击了解更多",
          "style": {
            "position": "lower_third",
            "density": "high"
          }
        }
      ]
    }
  ],
  "mapping": [
    {
      "sourceId": "slot_hook_visual",
      "sourceType": "slot",
      "targetClipId": "clip_15k5ji0",
      "status": "matched",
      "explanation": "Matched hook_visual to source shot source_shot_1 using tag product_like.",
      "usedAssetIds": [
        "demo_source_video"
      ]
    },
    {
      "sourceId": "slot_product_closeup",
      "sourceType": "slot",
      "targetClipId": "clip_re2sfv",
      "status": "matched",
      "explanation": "Matched product_closeup to source shot source_shot_1 using tag product_like.",
      "usedAssetIds": [
        "demo_source_video"
      ]
    },
    {
      "sourceId": "slot_usage_scene",
      "sourceType": "slot",
      "targetClipId": "clip_iw0vik",
      "status": "matched",
      "explanation": "Matched usage_scene to source shot source_shot_1 using tag usage_scene.",
      "usedAssetIds": [
        "demo_source_video"
      ]
    },
    {
      "sourceId": "slot_text_subtitle",
      "sourceType": "slot",
      "targetClipId": "clip_1n06m9o",
      "status": "matched",
      "explanation": "Matched text_or_subtitle to source shot source_shot_4 using tag text_card_candidate.",
      "usedAssetIds": [
        "demo_source_video"
      ]
    },
    {
      "sourceId": "slot_comparison_scene",
      "sourceType": "slot",
      "targetClipId": "clip_14ek4xg",
      "status": "weak_match",
      "explanation": "No strong source shot exists, but prompt copy can support a card or overlay."
    },
    {
      "sourceId": "slot_cta_visual",
      "sourceType": "slot",
      "targetClipId": "clip_1kpgjst",
      "status": "weak_match",
      "explanation": "No strong source shot exists, but prompt copy can support a card or overlay."
    }
  ],
  "gapReport": [
    {
      "id": "gap_1pt4w04",
      "slotId": "slot_comparison_scene",
      "gapType": "comparison_scene",
      "severity": "medium",
      "impact": "comparison_scene has weak prompt-only support and needs packaging support.",
      "recommendedStrategies": [
        "text_card",
        "packaging_overlay",
        "reorder_structure"
      ]
    },
    {
      "id": "gap_176xcyx",
      "slotId": "slot_cta_visual",
      "gapType": "cta_visual",
      "severity": "medium",
      "impact": "cta_visual has weak prompt-only support and needs packaging support.",
      "recommendedStrategies": [
        "packaging_overlay",
        "text_card"
      ]
    }
  ],
  "fillPlan": [
    {